### ISSUE TITLE
Enhancement request: Make WSVPN server's ping frame interval configurable.

### ISSUE THREAD

**Issue by vochong** [Doridian/wsvpn#13]
Hi Mark,

Different network environments (behind NAT, behind proxy, no NAT/no proxy etc.) may place different restrictions on Websocket connections.  Based on my tests with the current WSVPN, it looks like the WSVPN server sends a PING frame to the client every 10 minutes.   Can you please make the WSVPN server's PING frame interval configurable so it can be adjusted for different network environments. 

For very reliable networks between WSVPN client and server with persistent VPN connection, we can configure the PING frame interval to be very long or disable it altogether.  This will make the connection as silent as possible (kind of the same approach used by Wireguard).  This will also help reduce battery power consumption for low power IoT devices running the WSVPN client etc.

This capability will make WSVPN the most incredibly versatile and flexible VPN solution in the whole world :-).  Thanks so much!

**Comment by Doridian** [comment]
Done, see `ping-interval` and `ping-timeout`

**Comment by vochong** [comment]
Hi Mark,

I think there are some issues with the new ping implementation.

- The current ping implementation seems to use the regular ICMP ping, not the Websocket PING frame as described in the Websocket PING-PONG mechanism (https://datatracker.ietf.org/doc/html/rfc6455)

- The ping-interval setting does not work as expected.  For example, I set the ping-interval to be 1 hour on the client, but tcpdump capture indicates that it sends an ICMP ping to the server every 1 minute, as seen below:

CLIENT:   --ping-interval 3600s --ping-timeout 10s

tcpdump -i tun1 -n
tcpdump: verbose output suppressed, use -v or -vv for full protocol decode
listening on tun1, link-type RAW (Raw IP), capture size 262144 bytes
17:58:02.029298 IP 192.168.3.2 > 192.168.3.1: ICMP echo request, id 20390, seq 0, length 64
17:58:02.029504 IP 192.168.3.1 > 192.168.3.2: ICMP echo reply, id 20390, seq 0, length 64

17:59:01.150755 IP 192.168.3.2 > 192.168.3.1: ICMP echo request, id 20481, seq 0, length 64
17:59:01.150971 IP 192.168.3.1 > 192.168.3.2: ICMP echo reply, id 20481, seq 0, length 64

18:00:01.219708 IP 192.168.3.2 > 192.168.3.1: ICMP echo request, id 20575, seq 0, length 64
18:00:01.219901 IP 192.168.3.1 > 192.168.3.2: ICMP echo reply, id 20575, seq 0, length 64

**Comment by Doridian** [comment]
The server does not send ICMP packets by itself at all.
It only sends web socket ping frames.
Those ICMP packets most be caused by something that isn't wsvpn

**Comment by Doridian** [comment]
Also to note you won't be able to see the ping frames on the tun interface. Those would be on the interface the VPN actually uses to talk to the server or the client. As in your primary interface like eth0 or similar

**Comment by vochong** [comment]
Hi Mark,

I forgot that I added a cron job (to be executed every minute) for a script with some fping in it in the morning and that totally misled me to think there might be something wrong with your new ping change.  I'm very sorry for the false alarm!.

**Comment by vochong** [comment]
I'm shocked at how well and bug free every time you pushed out a new code change (and in a very short time!).   I have tried many different ping-interval settings and captured the Websocket control channel ping-pong traffic and they all work like clockwork.  Super Microsoft engineer!
